item,itemLabel,position,positionLabel,start,psid
Q1026465,Rebecca Kadaga,Q104668229,Deputy Prime Minister of Uganda,2021-06-21,Q1026465-552A5321-2483-4A61-9B30-186E03C4C240
Q24572616,Jane Aceng,Q112658314,Minister of Health of Uganda,2016-06-06,Q24572616-83068333-4980-d316-5e35-8b7edff80b31
Q62481397,Robinah Nabbanja,Q2462330,Prime Minister of Uganda,2021-06-21,Q62481397-28a0e090-4f28-6203-5937-35b97b9563b3
Q6787393,Matia Kasaija,Q98966310,Finance Minister of Uganda,2015-03-01,Q6787393-0D3E439F-172D-4848-885F-F93660F4F239
Q8023150,Wilson Muruuli Mukasa,Q99030163,Justice Minister of Uganda,2022-01-19,Q8023150-BECAEE91-44C4-452D-BFBD-BB69122A5E18
